{
 "id": "spell.de-la-carne-a-la-piedra",
 "name": "De la carne a la piedra",
 "level": 6,
 "cantrip": false,
 "school": "Transmutación",
 "classes": [
  "druida",
  "hechicero",
  "mago"
 ],
 "ritual": false,
 "concentration": true,
 "castingTime": {
  "raw": "Acción",
  "ritual": false,
  "kind": "action"
 },
 "range": {
  "raw": "18 m",
  "kind": "ranged",
  "meters": 18
 },
 "components": {
  "raw": "V, S, M (una pluma de cocatriz)",
  "v": true,
  "s": true,
  "m": true,
  "material": "una pluma de cocatriz",
  "consumed": false
 },
 "duration": {
  "raw": "Concentración, hasta 1 minuto",
  "concentration": true,
  "kind": "timed",
  "value": 1,
  "unit": "minuto"
 },
 "text": "Intentas convertir en piedra a una criatura que puedas ver dentro del alcance. El objetivo hace una tirada de salvación de Constitución. Si la falla, tendrá el estado de apresado hasta que el conjuro termine. Si la supera, su velocidad será 0 hasta el principio de tu siguiente turno. Los autómatas superan automáticamente la tirada de salvación.\n\nUn objetivo apresado realiza otra tirada de salvación de Constitución al final de cada uno de sus turnos. Si la supera tres veces, el conjuro termina. Si la falla tres veces, se convierte en piedra y sufre el estado de petrificada hasta que termine el conjuro. Los éxitos y los fallos no tienen por qué ser consecutivos: lleva la cuenta de ambos hasta que el objetivo tenga tres de un mismo tipo.\n\nSi mantienes la concentración en este conjuro durante toda su duración posible, el objetivo tendrá el estado de petrificado hasta que un conjuro restablecimiento mayor u otro efecto mágico similar le ponga fin.",
 "blocks": [
  {
   "type": "paragraph",
   "page": 138,
   "md": "Intentas convertir en piedra a una criatura que puedas ver dentro del alcance. El objetivo hace una tirada de salvación de Constitución. Si la falla, tendrá el estado de apresado hasta que el conjuro termine. Si la supera, su velocidad será 0 hasta el principio de tu siguiente turno. Los autómatas superan automáticamente la tirada de salvación.",
   "text": "Intentas convertir en piedra a una criatura que puedas ver dentro del alcance. El objetivo hace una tirada de salvación de Constitución. Si la falla, tendrá el estado de apresado hasta que el conjuro termine. Si la supera, su velocidad será 0 hasta el principio de tu siguiente turno. Los autómatas superan automáticamente la tirada de salvación."
  },
  {
   "type": "paragraph",
   "page": 138,
   "md": "Un objetivo apresado realiza otra tirada de salvación de Constitución al final de cada uno de sus turnos. Si la supera tres veces, el conjuro termina. Si la falla tres veces, se convierte en piedra y sufre el estado de petrificada hasta que termine el conjuro. Los éxitos y los fallos no tienen por qué ser consecutivos: lleva la cuenta de ambos hasta que el objetivo tenga tres de un mismo tipo.",
   "text": "Un objetivo apresado realiza otra tirada de salvación de Constitución al final de cada uno de sus turnos. Si la supera tres veces, el conjuro termina. Si la falla tres veces, se convierte en piedra y sufre el estado de petrificada hasta que termine el conjuro. Los éxitos y los fallos no tienen por qué ser consecutivos: lleva la cuenta de ambos hasta que el objetivo tenga tres de un mismo tipo."
  },
  {
   "type": "paragraph",
   "page": 138,
   "md": "Si mantienes la concentración en este conjuro durante toda su duración posible, el objetivo tendrá el estado de petrificado hasta que un conjuro *restablecimiento mayor* u otro efecto mágico similar le ponga fin.",
   "text": "Si mantienes la concentración en este conjuro durante toda su duración posible, el objetivo tendrá el estado de petrificado hasta que un conjuro restablecimiento mayor u otro efecto mágico similar le ponga fin."
  }
 ],
 "source": {
  "book": "SRD 5.2.1 es",
  "page": 138
 },
 "refs": [
  "spell.restablecimiento-mayor"
 ]
}