{
 "id": "spell.esfera-congelante",
 "name": "Esfera congelante",
 "level": 6,
 "cantrip": false,
 "school": "Evocación",
 "classes": [
  "hechicero",
  "mago"
 ],
 "ritual": false,
 "concentration": false,
 "castingTime": {
  "raw": "Acción",
  "ritual": false,
  "kind": "action"
 },
 "range": {
  "raw": "90 m",
  "kind": "ranged",
  "meters": 90
 },
 "components": {
  "raw": "V, S, M (una esfera de cristal en miniatura)",
  "v": true,
  "s": true,
  "m": true,
  "material": "una esfera de cristal en miniatura",
  "consumed": false
 },
 "duration": {
  "raw": "Instantáneo",
  "concentration": false,
  "kind": "instantaneous"
 },
 "text": "Un globo glacial surge de ti y golpea un punto de tu elección dentro del alcance, donde explota en una esfera de 18 m de radio. Todas las criaturas situadas en la zona realizan una tirada de salvación de Constitución; sufrirán 10d6 de daño de frío si la fallan o la mitad del daño si la superan.\n\nSi el globo golpea una masa de agua, la congelará hasta una profundidad de 15 cm en un área cuadrada de 9 m de lado. El hielo dura 1 minuto. Las criaturas que estuvieran nadando en la superficie del agua congelada quedarán atrapadas en el hielo y tendrán el estado de apresadas. Una criatura atrapada puede utilizar una acción para hacer una prueba de Fuerza (Atletismo) contra tu CD de salvación de conjuros para liberarse.\n\nPuedes renunciar a lanzar el globo tras completar el conjuro. En ese caso, en tu mano aparecerá un globo de tamaño similar a un proyectil de honda que resulta frío al tacto. En cualquier momento, tú o una criatura a la que le entregues el orbe podéis lanzarlo con la mano (hasta un alcance de 12 m) o arrojarlo con una honda (hasta el alcance normal de la honda). Se hará añicos al impactar y causará el mismo efecto que el uso normal del conjuro. También puedes dejar el orbe en el suelo sin hacerlo pedazos y, tras 1 minuto, explotará si nadie lo ha hecho estallar.\n\nCon un espacio de conjuro de nivel superior. El daño aumenta en 1d6 por cada nivel por encima de 6 que tenga el espacio.",
 "blocks": [
  {
   "type": "paragraph",
   "page": 147,
   "md": "Un globo glacial surge de ti y golpea un punto de tu elección dentro del alcance, donde explota en una esfera de 18 m de radio. Todas las criaturas situadas en la zona realizan una tirada de salvación de Constitución; sufrirán 10d6 de daño de frío si la fallan o la mitad del daño si la superan.",
   "text": "Un globo glacial surge de ti y golpea un punto de tu elección dentro del alcance, donde explota en una esfera de 18 m de radio. Todas las criaturas situadas en la zona realizan una tirada de salvación de Constitución; sufrirán 10d6 de daño de frío si la fallan o la mitad del daño si la superan."
  },
  {
   "type": "paragraph",
   "page": 147,
   "md": "Si el globo golpea una masa de agua, la congelará hasta una profundidad de 15 cm en un área cuadrada de 9 m de lado. El hielo dura 1 minuto. Las criaturas que estuvieran nadando en la superficie del agua congelada quedarán atrapadas en el hielo y tendrán el estado de apresadas. Una criatura atrapada puede utilizar una acción para hacer una prueba de Fuerza (Atletismo) contra tu CD de salvación de conjuros para liberarse.",
   "text": "Si el globo golpea una masa de agua, la congelará hasta una profundidad de 15 cm en un área cuadrada de 9 m de lado. El hielo dura 1 minuto. Las criaturas que estuvieran nadando en la superficie del agua congelada quedarán atrapadas en el hielo y tendrán el estado de apresadas. Una criatura atrapada puede utilizar una acción para hacer una prueba de Fuerza (Atletismo) contra tu CD de salvación de conjuros para liberarse."
  },
  {
   "type": "paragraph",
   "page": 147,
   "md": "Puedes renunciar a lanzar el globo tras completar el conjuro. En ese caso, en tu mano aparecerá un globo de tamaño similar a un proyectil de honda que resulta frío al tacto. En cualquier momento, tú o una criatura a la que le entregues el orbe podéis lanzarlo con la mano (hasta un alcance de 12 m) o arrojarlo con una honda (hasta el alcance normal de la honda). Se hará añicos al impactar y causará el mismo efecto que el uso normal del conjuro. También puedes dejar el orbe en el suelo sin hacerlo pedazos y, tras 1 minuto, explotará si nadie lo ha hecho estallar.",
   "text": "Puedes renunciar a lanzar el globo tras completar el conjuro. En ese caso, en tu mano aparecerá un globo de tamaño similar a un proyectil de honda que resulta frío al tacto. En cualquier momento, tú o una criatura a la que le entregues el orbe podéis lanzarlo con la mano (hasta un alcance de 12 m) o arrojarlo con una honda (hasta el alcance normal de la honda). Se hará añicos al impactar y causará el mismo efecto que el uso normal del conjuro. También puedes dejar el orbe en el suelo sin hacerlo pedazos y, tras 1 minuto, explotará si nadie lo ha hecho estallar."
  },
  {
   "type": "definition",
   "page": 147,
   "md": "***Con un espacio de conjuro de nivel superior.*** El daño aumenta en 1d6 por cada nivel por encima de 6 que tenga el espacio.",
   "text": "Con un espacio de conjuro de nivel superior. El daño aumenta en 1d6 por cada nivel por encima de 6 que tenga el espacio."
  }
 ],
 "source": {
  "book": "SRD 5.2.1 es",
  "page": 147
 }
}