{
 "id": "spell.detectar-magia",
 "name": "Detectar magia",
 "level": 1,
 "cantrip": false,
 "school": "Adivinación",
 "classes": [
  "bardo",
  "brujo",
  "clérigo",
  "druida",
  "explorador",
  "hechicero",
  "mago",
  "paladín"
 ],
 "ritual": true,
 "concentration": true,
 "castingTime": {
  "raw": "Acción o ritual",
  "ritual": true,
  "kind": "action"
 },
 "range": {
  "raw": "Lanzador",
  "kind": "self"
 },
 "components": {
  "raw": "V, S",
  "v": true,
  "s": true,
  "m": false
 },
 "duration": {
  "raw": "Concentración, hasta 10 minutos",
  "concentration": true,
  "kind": "timed",
  "value": 10,
  "unit": "minuto"
 },
 "text": "Hasta que el conjuro termine, podrás percibir la presencia de efectos mágicos a 9 m o menos de ti. Si percibes alguno, puedes usar una acción de magia para ver una débil aura alrededor de cualquier objeto o criatura visible dentro de la zona que esté afectada por la magia y, si el efecto lo creó un conjuro, distingues a qué escuela mágica pertenece.\n\nEl conjuro no puede atravesar 30 cm de piedra, tierra o madera, 2,5 cm de metal o una lámina fina de plomo.",
 "blocks": [
  {
   "type": "paragraph",
   "page": 141,
   "md": "Hasta que el conjuro termine, podrás percibir la presencia de efectos mágicos a 9 m o menos de ti. Si percibes alguno, puedes usar una acción de magia para ver una débil aura alrededor de cualquier objeto o criatura visible dentro de la zona que esté afectada por la magia y, si el efecto lo creó un conjuro, distingues a qué escuela mágica pertenece.",
   "text": "Hasta que el conjuro termine, podrás percibir la presencia de efectos mágicos a 9 m o menos de ti. Si percibes alguno, puedes usar una acción de magia para ver una débil aura alrededor de cualquier objeto o criatura visible dentro de la zona que esté afectada por la magia y, si el efecto lo creó un conjuro, distingues a qué escuela mágica pertenece."
  },
  {
   "type": "paragraph",
   "page": 141,
   "md": "El conjuro no puede atravesar 30 cm de piedra, tierra o madera, 2,5 cm de metal o una lámina fina de plomo.",
   "text": "El conjuro no puede atravesar 30 cm de piedra, tierra o madera, 2,5 cm de metal o una lámina fina de plomo."
  }
 ],
 "source": {
  "book": "SRD 5.2.1 es",
  "page": 141
 }
}