{
 "id": "spell.zancada-prodigiosa",
 "name": "Zancada prodigiosa",
 "level": 1,
 "cantrip": false,
 "school": "Transmutación",
 "classes": [
  "bardo",
  "druida",
  "explorador",
  "mago"
 ],
 "ritual": false,
 "concentration": false,
 "castingTime": {
  "raw": "Acción",
  "ritual": false,
  "kind": "action"
 },
 "range": {
  "raw": "Toque",
  "kind": "touch"
 },
 "components": {
  "raw": "V, S, M (una pizca de tierra)",
  "v": true,
  "s": true,
  "m": true,
  "material": "una pizca de tierra",
  "consumed": false
 },
 "duration": {
  "raw": "1 hora",
  "concentration": false,
  "kind": "timed",
  "value": 1,
  "unit": "hora"
 },
 "text": "Tocas a una criatura y su velocidad aumenta en 3 m hasta que el conjuro termine.\n\nCon un espacio de conjuro de nivel superior. Puedes hacer objetivo a una criatura adicional por cada nivel por encima de 1 que tenga el espacio.",
 "blocks": [
  {
   "type": "paragraph",
   "page": 193,
   "md": "Tocas a una criatura y su velocidad aumenta en 3 m hasta que el conjuro termine.",
   "text": "Tocas a una criatura y su velocidad aumenta en 3 m hasta que el conjuro termine."
  },
  {
   "type": "definition",
   "page": 193,
   "md": "***Con un espacio de conjuro de nivel superior.*** Puedes hacer objetivo a una criatura adicional por cada nivel por encima de 1 que tenga el espacio.",
   "text": "Con un espacio de conjuro de nivel superior. Puedes hacer objetivo a una criatura adicional por cada nivel por encima de 1 que tenga el espacio."
  }
 ],
 "source": {
  "book": "SRD 5.2.1 es",
  "page": 193
 }
}