{
 "id": "spell.proteccion-contra-energia",
 "name": "Protección contra energía",
 "level": 3,
 "cantrip": false,
 "school": "Abjuración",
 "classes": [
  "clérigo",
  "druida",
  "explorador",
  "hechicero",
  "mago"
 ],
 "ritual": false,
 "concentration": true,
 "castingTime": {
  "raw": "Acción",
  "ritual": false,
  "kind": "action"
 },
 "range": {
  "raw": "Toque",
  "kind": "touch"
 },
 "components": {
  "raw": "V, S",
  "v": true,
  "s": true,
  "m": false
 },
 "duration": {
  "raw": "Concentración, hasta 1 hora",
  "concentration": true,
  "kind": "timed",
  "value": 1,
  "unit": "hora"
 },
 "text": "Hasta que termine el conjuro, una criatura voluntaria a la que toques tendrá resistencia a un tipo de daño de tu elección: ácido, frío, fuego, relámpago o trueno.",
 "blocks": [
  {
   "type": "paragraph",
   "page": 176,
   "md": "Hasta que termine el conjuro, una criatura voluntaria a la que toques tendrá resistencia a un tipo de daño de tu elección: ácido, frío, fuego, relámpago o trueno.",
   "text": "Hasta que termine el conjuro, una criatura voluntaria a la que toques tendrá resistencia a un tipo de daño de tu elección: ácido, frío, fuego, relámpago o trueno."
  }
 ],
 "source": {
  "book": "SRD 5.2.1 es",
  "page": 176
 }
}