{
 "id": "spell.muro-prismatico",
 "name": "Muro prismático",
 "level": 9,
 "cantrip": false,
 "school": "Abjuración",
 "classes": [
  "bardo",
  "mago"
 ],
 "ritual": false,
 "concentration": false,
 "castingTime": {
  "raw": "Acción",
  "ritual": false,
  "kind": "action"
 },
 "range": {
  "raw": "18 m",
  "kind": "ranged",
  "meters": 18
 },
 "components": {
  "raw": "V, S",
  "v": true,
  "s": true,
  "m": false
 },
 "duration": {
  "raw": "10 minutos",
  "concentration": false,
  "kind": "timed",
  "value": 10,
  "unit": "minuto"
 },
 "text": "Un plano de luz rutilante y multicolor forma un muro vertical opaco (de hasta 27 m de largo, 9 m de alto y 2,5 cm de grosor) centrado en un punto dentro del alcance. Como alternativa, le das al muro la forma de un globo de hasta 9 m de diámetro centrado en un punto dentro del alcance. El muro permanecerá allí hasta que termine el conjuro. Si lo colocas en un espacio que ocupa una criatura, el conjuro termina al instante sin surtir efecto.\n\nEl muro emite luz brillante hasta 30 m y luz tenue 30 m más allá. Las criaturas que indiques cuando lanzas el conjuro y tú podéis atravesar el muro y estar cerca de él sin sufrir daños. Si otra criatura que pueda ver el muro se acerca a 6 m o menos de él, deberá superar una tirada de salvación de Constitución o tendrá el estado de cegada durante 1 minuto.\n\nEl muro consta de siete capas, cada una de un color distinto. Cuando una criatura meta una mano en el muro o lo atraviese, lo debe hacer capa por capa hasta superarlas todas. Para cada una, deberá realizar una tirada de salvación de Destreza o quedará afectada por las propiedades de esa capa, como se describe en la tabla “Capas prismáticas”.\n\nEl muro, que tiene una CA de 10, se puede destruir capa por capa, en orden de rojo a violeta, por el medio específico para cada una de ellas. Si se destruye una capa, seguirá eliminada hasta que termine el conjuro. Campo antimagia no tiene efecto en el muro y disipar magia solo puede afectar a la capa violeta.\n\nestado de apresado y hará una tirada de salvación de Constitución al final de cada uno de sus turnos. Si la supera tres veces, el estado terminará. Si la falla tres veces, tendrá el estado de petrificado hasta que lo libere un efecto como el del conjuro restablecimiento mayor. Los éxitos y los fallos no tienen por qué ser consecutivos: lleva la cuenta de ambos hasta que el objetivo tenga tres de un mismo tipo. Efectos adicionales: no es posible lanzar conjuros a través de esta capa, que puede destruirse mediante la luz brillante del conjuro luz del día.",
 "blocks": [
  {
   "type": "paragraph",
   "page": 168,
   "md": "Un plano de luz rutilante y multicolor forma un muro vertical opaco (de hasta 27 m de largo, 9 m de alto y 2,5 cm de grosor) centrado en un punto dentro del alcance. Como alternativa, le das al muro la forma de un globo de hasta 9 m de diámetro centrado en un punto dentro del alcance. El muro permanecerá allí hasta que termine el conjuro. Si lo colocas en un espacio que ocupa una criatura, el conjuro termina al instante sin surtir efecto.",
   "text": "Un plano de luz rutilante y multicolor forma un muro vertical opaco (de hasta 27 m de largo, 9 m de alto y 2,5 cm de grosor) centrado en un punto dentro del alcance. Como alternativa, le das al muro la forma de un globo de hasta 9 m de diámetro centrado en un punto dentro del alcance. El muro permanecerá allí hasta que termine el conjuro. Si lo colocas en un espacio que ocupa una criatura, el conjuro termina al instante sin surtir efecto."
  },
  {
   "type": "paragraph",
   "page": 168,
   "md": "El muro emite luz brillante hasta 30 m y luz tenue 30 m más allá. Las criaturas que indiques cuando lanzas el conjuro y tú podéis atravesar el muro y estar cerca de él sin sufrir daños. Si otra criatura que pueda ver el muro se acerca a 6 m o menos de él, deberá superar una tirada de salvación de Constitución o tendrá el estado de cegada durante 1 minuto.",
   "text": "El muro emite luz brillante hasta 30 m y luz tenue 30 m más allá. Las criaturas que indiques cuando lanzas el conjuro y tú podéis atravesar el muro y estar cerca de él sin sufrir daños. Si otra criatura que pueda ver el muro se acerca a 6 m o menos de él, deberá superar una tirada de salvación de Constitución o tendrá el estado de cegada durante 1 minuto."
  },
  {
   "type": "paragraph",
   "page": 168,
   "md": "El muro consta de siete capas, cada una de un color distinto. Cuando una criatura meta una mano en el muro o lo atraviese, lo debe hacer capa por capa hasta superarlas todas. Para cada una, deberá realizar una tirada de salvación de Destreza o quedará afectada por las propiedades de esa capa, como se describe en la tabla “Capas prismáticas”.",
   "text": "El muro consta de siete capas, cada una de un color distinto. Cuando una criatura meta una mano en el muro o lo atraviese, lo debe hacer capa por capa hasta superarlas todas. Para cada una, deberá realizar una tirada de salvación de Destreza o quedará afectada por las propiedades de esa capa, como se describe en la tabla “Capas prismáticas”."
  },
  {
   "type": "paragraph",
   "page": 169,
   "md": "El muro, que tiene una CA de 10, se puede destruir capa por capa, en orden de rojo a violeta, por el medio específico para cada una de ellas. Si se destruye una capa, seguirá eliminada hasta que termine el conjuro. *Campo antimagia* no tiene efecto en el muro y *disipar magia* solo puede afectar a la capa violeta.",
   "text": "El muro, que tiene una CA de 10, se puede destruir capa por capa, en orden de rojo a violeta, por el medio específico para cada una de ellas. Si se destruye una capa, seguirá eliminada hasta que termine el conjuro. Campo antimagia no tiene efecto en el muro y disipar magia solo puede afectar a la capa violeta."
  },
  {
   "type": "table",
   "page": 169,
   "caption": "Capas prismáticas",
   "header": [
    "Orden",
    "Efectos"
   ],
   "rows": [
    [
     "1",
     "Roja. Si falla la tirada: 12d6 de daño de fuego. Si supera la tirada: la mitad de daño. Efectos adicionales: los ataques a distancia no mágicos no pueden atravesar esta capa, que se destruye si recibe al menos 25 de daño de frío."
    ],
    [
     "2",
     "Naranja. Si falla la tirada: 12d6 de daño de ácido. Si supera la tirada: la mitad de daño. Efectos adicionales: los ataques a distancia mágicos no atraviesan esta capa, que puede destruirse mediante un viento fuerte (como el que crea ráfaga de viento)."
    ],
    [
     "3",
     "Amarilla. Si falla la tirada: 12d6 de daño de relámpago. Si supera la tirada: la mitad de daño. Efectos adicionales: la capa se destruye si recibe al menos 60 de daño de fuerza."
    ],
    [
     "4",
     "Verde. Si falla la tirada: 12d6 de daño de veneno. Si supera la tirada: la mitad de daño. Efectos adicionales: un conjuro pasamuros u otro del mismo nivel o superior que puedan abrir un portal en una superficie sólida destruirán esta capa."
    ],
    [
     "5",
     "Azul. Si falla la tirada: 12d6 de daño de frío. Si supera la tirada: la mitad de daño. Efectos adicionales: la capa se destruye si recibe al menos 25 de daño de fuego."
    ],
    [
     "6",
     "Añil. Si falla la tirada: el objetivo tendrá el"
    ],
    [
     "7",
     "Violeta. Si falla la tirada: el objetivo tendrá el"
    ],
    [
     "",
     "estado de cegado y hará una tirada de salva"
    ],
    [
     "",
     "ción de Sabiduría al principio de tu siguiente"
    ],
    [
     "",
     "turno. Si la supera, el estado terminará. Si la"
    ],
    [
     "",
     "falla, el estado terminará y la criatura se"
    ],
    [
     "",
     "teletransportará a otro plano de existencia"
    ],
    [
     "",
     "(a elección de tu GM). Efectos adicionales: esta"
    ],
    [
     "",
     "capa puede destruirse mediante disipar magia."
    ]
   ]
  },
  {
   "type": "property",
   "page": 169,
   "md": "estado de apresado y hará una tirada de salvación de Constitución al final de cada uno de sus turnos. Si la supera tres veces, el estado terminará. Si la falla tres veces, tendrá el estado de petrificado hasta que lo libere un efecto como el del conjuro *restablecimiento mayor*. Los éxitos y los fallos no tienen por qué ser consecutivos: lleva la cuenta de ambos hasta que el objetivo tenga tres de un mismo tipo. *Efectos adicionales:* no es posible lanzar conjuros a través de esta capa, que puede destruirse mediante la luz brillante del conjuro *luz del día*.",
   "text": "estado de apresado y hará una tirada de salvación de Constitución al final de cada uno de sus turnos. Si la supera tres veces, el estado terminará. Si la falla tres veces, tendrá el estado de petrificado hasta que lo libere un efecto como el del conjuro restablecimiento mayor. Los éxitos y los fallos no tienen por qué ser consecutivos: lleva la cuenta de ambos hasta que el objetivo tenga tres de un mismo tipo. Efectos adicionales: no es posible lanzar conjuros a través de esta capa, que puede destruirse mediante la luz brillante del conjuro luz del día."
  }
 ],
 "source": {
  "book": "SRD 5.2.1 es",
  "page": 168
 },
 "refs": [
  "spell.campo-antimagia",
  "spell.disipar-magia",
  "spell.restablecimiento-mayor",
  "spell.luz-del-dia"
 ]
}