{
 "id": "spell.imponer-maldicion",
 "name": "Imponer maldición",
 "level": 3,
 "cantrip": false,
 "school": "Nigromancia",
 "classes": [
  "bardo",
  "clérigo",
  "mago"
 ],
 "ritual": false,
 "concentration": true,
 "castingTime": {
  "raw": "Acción",
  "ritual": false,
  "kind": "action"
 },
 "range": {
  "raw": "Toque",
  "kind": "touch"
 },
 "components": {
  "raw": "V, S",
  "v": true,
  "s": true,
  "m": false
 },
 "duration": {
  "raw": "Concentración, hasta 1 minuto",
  "concentration": true,
  "kind": "timed",
  "value": 1,
  "unit": "minuto"
 },
 "text": "Tocas a una criatura, que deberá superar una tirada de salvación de Sabiduría o quedará maldecida hasta que el conjuro termine. Hasta que se rompa la maldición, el objetivo sufrirá uno de los siguientes efectos a tu elección:\n\n• Elige una característica. El objetivo tendrá desventaja en las pruebas de característica y tiradas de salvación hechas con esa característica.\n\n• El objetivo tendrá desventaja en las tiradas de ataque contra ti.\n\n• En combate, el objetivo deberá superar una tirada de salvación de Sabiduría al principio de cada uno de sus turnos o se verá obligado a llevar a cabo la acción de esquivar ese turno.\n\n• Si causas daño al objetivo con una tirada de ataque o un conjuro, recibirá 1d8 de daño necrótico adicional.\n\nCon un espacio de conjuro de nivel superior. Si lanzas este conjuro con un espacio de nivel 4, puedes mantener la concentración en él hasta 10 minutos. Si usas un espacio de nivel 5 o superior, el conjuro no requiere concentración y la duración pasará a ser de 8 horas (espacio de nivel 5 o 6) o de 24 horas (espacio de nivel 7 u 8). Si usas un espacio de conjuro de nivel 9, el conjuro durará hasta que sea disipado.",
 "blocks": [
  {
   "type": "paragraph",
   "page": 158,
   "md": "Tocas a una criatura, que deberá superar una tirada de salvación de Sabiduría o quedará maldecida hasta que el conjuro termine. Hasta que se rompa la maldición, el objetivo sufrirá uno de los siguientes efectos a tu elección:",
   "text": "Tocas a una criatura, que deberá superar una tirada de salvación de Sabiduría o quedará maldecida hasta que el conjuro termine. Hasta que se rompa la maldición, el objetivo sufrirá uno de los siguientes efectos a tu elección:"
  },
  {
   "type": "list-item",
   "page": 158,
   "md": "• Elige una característica. El objetivo tendrá desventaja en las pruebas de característica y tiradas de salvación hechas con esa característica.",
   "text": "• Elige una característica. El objetivo tendrá desventaja en las pruebas de característica y tiradas de salvación hechas con esa característica."
  },
  {
   "type": "list-item",
   "page": 158,
   "md": "• El objetivo tendrá desventaja en las tiradas de ataque contra ti.",
   "text": "• El objetivo tendrá desventaja en las tiradas de ataque contra ti."
  },
  {
   "type": "list-item",
   "page": 158,
   "md": "• En combate, el objetivo deberá superar una tirada de salvación de Sabiduría al principio de cada uno de sus turnos o se verá obligado a llevar a cabo la acción de esquivar ese turno.",
   "text": "• En combate, el objetivo deberá superar una tirada de salvación de Sabiduría al principio de cada uno de sus turnos o se verá obligado a llevar a cabo la acción de esquivar ese turno."
  },
  {
   "type": "list-item",
   "page": 158,
   "md": "• Si causas daño al objetivo con una tirada de ataque o un conjuro, recibirá 1d8 de daño necrótico adicional.",
   "text": "• Si causas daño al objetivo con una tirada de ataque o un conjuro, recibirá 1d8 de daño necrótico adicional."
  },
  {
   "type": "definition",
   "page": 158,
   "md": "***Con un espacio de conjuro de nivel superior.*** Si lanzas este conjuro con un espacio de nivel 4, puedes mantener la concentración en él hasta 10 minutos. Si usas un espacio de nivel 5 o superior, el conjuro no requiere concentración y la duración pasará a ser de 8 horas (espacio de nivel 5 o 6) o de 24 horas (espacio de nivel 7 u 8). Si usas un espacio de conjuro de nivel 9, el conjuro durará hasta que sea disipado.",
   "text": "Con un espacio de conjuro de nivel superior. Si lanzas este conjuro con un espacio de nivel 4, puedes mantener la concentración en él hasta 10 minutos. Si usas un espacio de nivel 5 o superior, el conjuro no requiere concentración y la duración pasará a ser de 8 horas (espacio de nivel 5 o 6) o de 24 horas (espacio de nivel 7 u 8). Si usas un espacio de conjuro de nivel 9, el conjuro durará hasta que sea disipado."
  }
 ],
 "source": {
  "book": "SRD 5.2.1 es",
  "page": 158
 }
}