{
 "id": "spell.cono-de-frio",
 "name": "Cono de frío",
 "level": 5,
 "cantrip": false,
 "school": "Evocación",
 "classes": [
  "druida",
  "hechicero",
  "mago"
 ],
 "ritual": false,
 "concentration": false,
 "castingTime": {
  "raw": "Acción",
  "ritual": false,
  "kind": "action"
 },
 "range": {
  "raw": "Lanzador",
  "kind": "self"
 },
 "components": {
  "raw": "V, S, M (un cono pequeño de cristal o vidrio)",
  "v": true,
  "s": true,
  "m": true,
  "material": "un cono pequeño de cristal o vidrio",
  "consumed": false
 },
 "duration": {
  "raw": "Instantáneo",
  "concentration": false,
  "kind": "instantaneous"
 },
 "text": "Emites una ráfaga de aire helado. Todas las criaturas situadas en un cono de 18 m que se origina en ti hacen una tirada de salvación de Constitución; sufrirán 8d8 de daño de frío si la fallan o la mitad de daño si la superan. Si una criatura muere a causa de este conjuro, se convertirá en una estatua congelada hasta que se descongele.\n\nCon un espacio de conjuro de nivel superior. El daño aumenta en 1d8 por cada nivel por encima de 5 que tenga el espacio.",
 "blocks": [
  {
   "type": "paragraph",
   "page": 133,
   "md": "Emites una ráfaga de aire helado. Todas las criaturas situadas en un cono de 18 m que se origina en ti hacen una tirada de salvación de Constitución; sufrirán 8d8 de daño de frío si la fallan o la mitad de daño si la superan. Si una criatura muere a causa de este conjuro, se convertirá en una estatua congelada hasta que se descongele.",
   "text": "Emites una ráfaga de aire helado. Todas las criaturas situadas en un cono de 18 m que se origina en ti hacen una tirada de salvación de Constitución; sufrirán 8d8 de daño de frío si la fallan o la mitad de daño si la superan. Si una criatura muere a causa de este conjuro, se convertirá en una estatua congelada hasta que se descongele."
  },
  {
   "type": "definition",
   "page": 133,
   "md": "***Con un espacio de conjuro de nivel superior.*** El daño aumenta en 1d8 por cada nivel por encima de 5 que tenga el espacio.",
   "text": "Con un espacio de conjuro de nivel superior. El daño aumenta en 1d8 por cada nivel por encima de 5 que tenga el espacio."
  }
 ],
 "source": {
  "book": "SRD 5.2.1 es",
  "page": 133
 }
}