{
 "id": "spell.dedo-de-la-muerte",
 "name": "Dedo de la muerte",
 "level": 7,
 "cantrip": false,
 "school": "Nigromancia",
 "classes": [
  "brujo",
  "hechicero",
  "mago"
 ],
 "ritual": false,
 "concentration": false,
 "castingTime": {
  "raw": "Acción",
  "ritual": false,
  "kind": "action"
 },
 "range": {
  "raw": "18 m",
  "kind": "ranged",
  "meters": 18
 },
 "components": {
  "raw": "V, S",
  "v": true,
  "s": true,
  "m": false
 },
 "duration": {
  "raw": "Instantáneo",
  "concentration": false,
  "kind": "instantaneous"
 },
 "text": "Desatas una energía negativa hacia una criatura que puedas ver dentro del alcance. El objetivo hace una tirada de salvación de Constitución; sufrirá 7d8 + 30 de daño necrótico si la falla o la mitad del daño si la supera.\n\nSi un humanoide muere a causa de este conjuro, se alzará al principio de tu siguiente turno como un\n\nzombi (consulta el capítulo “Monstruos”) y seguirá tus órdenes verbales.",
 "blocks": [
  {
   "type": "paragraph",
   "page": 138,
   "md": "Desatas una energía negativa hacia una criatura que puedas ver dentro del alcance. El objetivo hace una tirada de salvación de Constitución; sufrirá 7d8 + 30 de daño necrótico si la falla o la mitad del daño si la supera.",
   "text": "Desatas una energía negativa hacia una criatura que puedas ver dentro del alcance. El objetivo hace una tirada de salvación de Constitución; sufrirá 7d8 + 30 de daño necrótico si la falla o la mitad del daño si la supera."
  },
  {
   "type": "paragraph",
   "page": 138,
   "md": "Si un humanoide muere a causa de este conjuro, se alzará al principio de tu siguiente turno como un",
   "text": "Si un humanoide muere a causa de este conjuro, se alzará al principio de tu siguiente turno como un"
  },
  {
   "type": "definition",
   "page": 138,
   "md": "**zombi** (consulta el capítulo “Monstruos”) y seguirá tus órdenes verbales.",
   "text": "zombi (consulta el capítulo “Monstruos”) y seguirá tus órdenes verbales."
  }
 ],
 "source": {
  "book": "SRD 5.2.1 es",
  "page": 138
 }
}