{
 "id": "spell.silencio",
 "name": "Silencio",
 "level": 2,
 "cantrip": false,
 "school": "Ilusionismo",
 "classes": [
  "bardo",
  "clérigo",
  "explorador"
 ],
 "ritual": true,
 "concentration": true,
 "castingTime": {
  "raw": "Acción o ritual",
  "ritual": true,
  "kind": "action"
 },
 "range": {
  "raw": "36 m",
  "kind": "ranged",
  "meters": 36
 },
 "components": {
  "raw": "V, S",
  "v": true,
  "s": true,
  "m": false
 },
 "duration": {
  "raw": "Concentración, hasta 10 minutos",
  "concentration": true,
  "kind": "timed",
  "value": 10,
  "unit": "minuto"
 },
 "text": "Hasta que termine el conjuro, creas una esfera de 6 m de radio centrada en un punto de tu elección dentro del alcance. Ningún sonido podrá atravesarla ni originarse en su interior. Toda criatura u objeto tiene inmunidad al daño de trueno si se halla completamente dentro de la esfera, y las criaturas tienen el estado de ensordecidas en su interior. Dentro de ella es imposible lanzar conjuros que tengan un componente verbal.",
 "blocks": [
  {
   "type": "paragraph",
   "page": 184,
   "md": "Hasta que termine el conjuro, creas una esfera de 6 m de radio centrada en un punto de tu elección dentro del alcance. Ningún sonido podrá atravesarla ni originarse en su interior. Toda criatura u objeto tiene inmunidad al daño de trueno si se halla completamente dentro de la esfera, y las criaturas tienen el estado de ensordecidas en su interior. Dentro de ella es imposible lanzar conjuros que tengan un componente verbal.",
   "text": "Hasta que termine el conjuro, creas una esfera de 6 m de radio centrada en un punto de tu elección dentro del alcance. Ningún sonido podrá atravesarla ni originarse en su interior. Toda criatura u objeto tiene inmunidad al daño de trueno si se halla completamente dentro de la esfera, y las criaturas tienen el estado de ensordecidas en su interior. Dentro de ella es imposible lanzar conjuros que tengan un componente verbal."
  }
 ],
 "source": {
  "book": "SRD 5.2.1 es",
  "page": 184
 }
}